<?xml version="1.0" encoding="UTF-8"?>
<!--Sample XML file generated by XMLSpy v2022 rel. 2 (x64) (http://www.altova.com)-->
<courses xmlns="http://abis.be/courses" xmlns:xsi="http://www.w3.org/2001/XMLSchema-instance" xsi:schemaLocation="http://abis.be/courses course.xsd">
	<course>
		<courseId>1</courseId>
		<shortTitle>SQLBAS</shortTitle>
		<longTitle>SQL Fundamentals</longTitle>
		<numberOfDays>2</numberOfDays>
		<pricePerDay>375.0</pricePerDay>
	</course>
	<course>
		<courseId>2</courseId>
		<shortTitle>SPRING</shortTitle>
		<longTitle>SPRING Fundamentals</longTitle>
		<numberOfDays>3</numberOfDays>
		<pricePerDay>450.0</pricePerDay>
	</course>
	<course>
		<courseId>3</courseId>
		<shortTitle>SPRINGREST</shortTitle>
		<longTitle>Building REST APIs with Spring Boot</longTitle>
		<numberOfDays>3</numberOfDays>
		<pricePerDay>500.0</pricePerDay>
	</course>
</courses>